{
  "schema_version": 1,
  "id": "ctg",
  "base_url": "https://www.capitaltg.com",
  "viewports": [
    {
      "id": "desktop",
      "width": 1440,
      "height": 1000
    },
    {
      "id": "mobile",
      "width": 390,
      "height": 844
    },
    {
      "id": "reflow",
      "width": 320,
      "height": 844
    }
  ],
  "pages": [
    {
      "id": "home",
      "path": "/",
      "h1_contains": "Uncompromising engineering excellence",
      "title_contains": "Capital Technology Group",
      "checks": [
        "content",
        "structure",
        "axe",
        "semantics"
      ],
      "viewports": [
        "desktop"
      ],
      "priority": "P0",
      "why": "First impression and entry into the main visitor journeys.",
      "language": "en"
    },
    {
      "id": "capabilities",
      "path": "/capabilities",
      "h1_contains": "Mission-ready engineering",
      "title_contains": "Capabilities",
      "checks": [
        "content"
      ],
      "viewports": [
        "desktop"
      ],
      "priority": "P1",
      "why": "Prospective customers must be able to understand offered services.",
      "language": "en"
    },
    {
      "id": "agentic-ai",
      "path": "/capabilities/agentic-ai",
      "h1_contains": "Agentic AI",
      "title_contains": "Agentic AI",
      "checks": [
        "content",
        "structure",
        "axe"
      ],
      "viewports": [
        "desktop"
      ],
      "priority": "P1",
      "why": "Representative service detail template and route to contact.",
      "language": "en"
    },
    {
      "id": "work",
      "path": "/insights",
      "h1_contains": "Unlocking Government Innovation",
      "title_contains": "Our Work",
      "checks": [
        "content",
        "structure",
        "axe",
        "semantics",
        "image-alt"
      ],
      "viewports": [
        "desktop"
      ],
      "priority": "P1",
      "why": "Portfolio demonstrates delivery credibility; representative card collection.",
      "language": "en"
    },
    {
      "id": "case-study",
      "path": "/case-studies/digital-identity-management",
      "h1_contains": "Streamlining Digital Identity Management",
      "title_contains": "Streamlining Digital Identity Management",
      "checks": [
        "content"
      ],
      "viewports": [
        "desktop"
      ],
      "priority": "P1",
      "why": "A concrete case study proves that listing links lead to substantive content.",
      "language": "en"
    },
    {
      "id": "about",
      "path": "/about",
      "h1_contains": "About Us",
      "title_contains": "About Us",
      "checks": [
        "content"
      ],
      "viewports": [
        "desktop"
      ],
      "priority": "P2",
      "why": "Company identity supports trust but is less urgent than conversion paths.",
      "language": "en"
    },
    {
      "id": "careers",
      "path": "/careers",
      "h1_contains": "Work with an impact",
      "title_contains": "Careers",
      "checks": [
        "content",
        "structure",
        "axe"
      ],
      "viewports": [
        "desktop"
      ],
      "priority": "P1",
      "why": "Recruiting is a key secondary business goal.",
      "language": "en"
    },
    {
      "id": "contact",
      "path": "/contact-us",
      "h1_contains": "We'd Love to Hear From You!",
      "title_contains": "Contact",
      "checks": [
        "content",
        "structure",
        "axe",
        "reflow"
      ],
      "viewports": [
        "desktop",
        "mobile",
        "reflow"
      ],
      "priority": "P0",
      "why": "Lead generation must remain reachable and usable across narrow and wide screens.",
      "language": "en"
    },
    {
      "id": "labs",
      "path": "/labs",
      "h1_contains": "Engineering Excellence",
      "title_contains": "Labs",
      "checks": [
        "content"
      ],
      "viewports": [
        "desktop"
      ],
      "priority": "P2",
      "why": "Public technical work helps visitors evaluate CTG expertise.",
      "language": "en"
    }
  ],
  "journeys": [
    {
      "id": "impact-to-case-study",
      "start": "/",
      "priority": "P0",
      "why": "Visitors should reach evidence of delivered work from the homepage.",
      "steps": [
        {
          "action": "click",
          "locator": {
            "role": "link",
            "name": "See our impact"
          }
        },
        {
          "action": "expect-url",
          "value": "/insights"
        },
        {
          "action": "expect",
          "locator": {
            "role": "heading",
            "level": 1
          },
          "assert": "text",
          "value": "Unlocking Government Innovation"
        },
        {
          "action": "click",
          "locator": {
            "role": "link",
            "name": "Streamlining Digital Identity Management",
            "exact": false
          }
        },
        {
          "action": "expect-url",
          "value": "/case-studies/digital-identity-management"
        },
        {
          "action": "expect",
          "locator": {
            "role": "heading",
            "level": 1
          },
          "assert": "text",
          "value": "Streamlining Digital Identity Management"
        }
      ],
      "viewport": "desktop",
      "accessibility": false
    },
    {
      "id": "capability-to-contact",
      "start": "/",
      "priority": "P0",
      "why": "Covers the customer discovery and inquiry funnel without sending a message.",
      "steps": [
        {
          "action": "click",
          "locator": {
            "selector": "main a[href=\"/capabilities/agentic-ai\"]"
          }
        },
        {
          "action": "expect-url",
          "value": "/capabilities/agentic-ai"
        },
        {
          "action": "expect",
          "locator": {
            "role": "heading",
            "level": 1
          },
          "assert": "text",
          "value": "Agentic AI"
        },
        {
          "action": "click",
          "locator": {
            "role": "link",
            "name": "Contact us"
          }
        },
        {
          "action": "expect-url",
          "value": "/contact-us"
        },
        {
          "action": "expect",
          "locator": {
            "label": "Email Address"
          },
          "assert": "visible"
        }
      ],
      "viewport": "desktop",
      "accessibility": false
    },
    {
      "id": "about-menu-to-careers",
      "start": "/",
      "priority": "P0",
      "why": "Candidates must find recruiting from primary navigation.",
      "steps": [
        {
          "action": "click",
          "locator": {
            "role": "link",
            "name": "About",
            "scope": "header"
          }
        },
        {
          "action": "expect",
          "locator": {
            "role": "link",
            "name": "About",
            "scope": "header"
          },
          "assert": "attribute",
          "attribute": "aria-expanded",
          "value": "true"
        },
        {
          "action": "click",
          "locator": {
            "role": "menuitem",
            "name": "Careers"
          }
        },
        {
          "action": "expect-url",
          "value": "/careers"
        },
        {
          "action": "expect",
          "locator": {
            "role": "heading",
            "level": 1
          },
          "assert": "text",
          "value": "Work with an impact"
        }
      ],
      "viewport": "desktop",
      "accessibility": false
    },
    {
      "id": "contact-input",
      "start": "/contact-us",
      "priority": "P0",
      "why": "Confirms editable labeled fields with synthetic values; submission is deliberately excluded.",
      "steps": [
        {
          "action": "fill",
          "locator": {
            "label": "Name"
          },
          "value": "QA Example"
        },
        {
          "action": "fill",
          "locator": {
            "label": "Organization"
          },
          "value": "Example Test Organization"
        },
        {
          "action": "fill",
          "locator": {
            "label": "Email Address"
          },
          "value": "qa@example.invalid"
        },
        {
          "action": "fill",
          "locator": {
            "label": "Phone Number"
          },
          "value": "202-555-0100"
        },
        {
          "action": "fill",
          "locator": {
            "label": "Message"
          },
          "value": "Synthetic QA input. Never submit this message."
        },
        {
          "action": "expect",
          "locator": {
            "role": "button",
            "name": "Send Message"
          },
          "assert": "visible"
        }
      ],
      "viewport": "desktop",
      "accessibility": false
    },
    {
      "id": "keyboard-menu",
      "start": "/",
      "priority": "P1",
      "why": "Keyboard users must reach, open, and escape the desktop menu with focus restored.",
      "steps": [
        {
          "action": "tab-to",
          "locator": {
            "role": "link",
            "name": "About",
            "scope": "header"
          },
          "max_tabs": 20
        },
        {
          "action": "keyboard",
          "value": "Enter"
        },
        {
          "action": "expect",
          "locator": {
            "role": "link",
            "name": "About",
            "scope": "header"
          },
          "assert": "attribute",
          "attribute": "aria-expanded",
          "value": "true"
        },
        {
          "action": "expect",
          "locator": {
            "role": "menu",
            "name": "About"
          },
          "assert": "visible"
        },
        {
          "action": "keyboard",
          "value": "ArrowDown"
        },
        {
          "action": "expect",
          "locator": {